kanji	index	reading	sentence
場	25	ば	こう いう 写真 は 結婚 式 以来 でし た の で 、 はじめ は とても 緊張 し まし た が 、 adam の その 場 を リラックス さ せる 雰囲気 と トーク の おかげ で 、 最終 的 に は ノリノリ で 撮影 を 行う こと が でき まし た 。
場	3	ジョウ	本 会議 場 や 特別 委員 会 室 で 議論 が 進む 傍ら で 、 居眠り や 私語 、 途中 離席 を する 議員 の 姿 が ちらほら 見受け られ た 。
場	6	ば	基本 的 に 生活 の 場 で ある 館 だ が 、 非常 の 際 に は 外敵 を 阻む 砦 と も なっ て おり 、 トールキン 自筆 の 挿絵 に 拠れ ば 、 館 の 前 の 橋 を 落とせ ば 外部 から の 侵入 を 阻む こと も 可能 な つくり と なっ て いる 模様 で ある 。
場	10	ジョウ	お 店 の 外観 は 綺麗 で 、 駐車 場 を 備え て いる 貴重 な 名古屋 西側 の 台湾 料理 屋 さん です 。
場	2	ジョウ	演習 場 の 入り口 に 近い 由布 市 湯布院 町 の 若杉 地区 で は 、 タクシー 送迎 を 実施 せ ず 、 町 が ガソリン 代 を 支給 し 、 保護 者 が 送り迎え を する 。
場	5	ジョウ	1982 年 に ゴルフ 場 開発 に 乗り出し 、 総観 グループ を 立ち上げる 。
場	2	ジョウ	駐車 場 から 見える “ 賀正 2010 ” の 文字 が 印象 的 だ 。
場	5	ジョウ	以前 自宅 の 駐車 場 を 舗装 し て もらっ た 会社 です 。
場	8	ば	現在 の 日本 の 公 教育 の 場 で は 「 ろう児 」 と いう 用語 は 使用 さ れ て い ない 。
場	5	ば	コズミック フラクチャー の 重力 場 フロー に 巻き込ま れ 消滅 し た 。
場	21	ジョウ	2012 年 10 月 25 日 - 26 日 に 屋外 競輪 場 と し て は 初めて 青森 競輪 場 で ミッドナイト 競輪 が 開催 さ れる こと と なっ た 。
場	19	ジョウ	5 月 11 日 , あいにく の 雨 に も かかわら ず , デモ 出発 前 の 集会 場 と なっ た 日比谷 公園 大 音楽 堂 は 傘 を 差し た 人々 で ほぼ 満杯 でし た 。
場	26	ば	フレデリックスバーグ に 向かう 途中 、 11 月 24 日 に ファルマウス に 到着 、 戦闘 が 発生 し た 12 月 13 日 まで その 場 に 留まっ た 。
場	18	ジョウ	遺体 の そば に 吉住 さん の もの と み られる 手提げ バッグ と 病院 の 駐車 場 に 車 が 残さ れ て い て 、 吉住 さん は 出勤 途中 に 事件 に 遭っ た と み られ て い ます 。
場	2	ジョウ	駐車 場 も 広い です 。
場	3	ジョウ	帯広 競馬 場 に は 馬場 に ヒーティング 設備 が 施さ れ 、 冬季 で も 馬場 が 凍結 する こと なく 競走 が 行える よう に なっ た 。
場	2	ジョウ	駐車 場 が 狭い 。
場	10	ジョウ	2011 年 3 月 6 日 国立 代々木 競技 場 第 一 体育 館 で 行わ れ た ASIA GIRLS EXPLOSION で この 楽曲 が 演奏 さ れ て いる 。
場	17	ジョウ	この ため 、 現在 、 各 施設 の 具体 的 名称 は 、 「 食肉 処理 場 」 「 食肉 センター 」 など の 名称 が 付さ れ て いる もの が 多い 。
場	15	ば	渋谷 の 居酒屋 は 仲間 たち と ワイワイ 日ごろ の ストレス を 発散 する 場 と し て 利用 し て い ます 。
場	5	ジョウ	テグシガルパ の 主要 飛行 場 は トンコンティン 国際 空港 で ある 。
場	9	ば	これ を 説明 する ため に 、 その 場 は 浅い 海 で あっ た が 、 堆積 層 の 増加 と とも に 沈降 し 、 その ため に 浅い 海 で あり 続け た 、 と する の が この 理論 で ある 。
場	6	ジョウ	在日 米 海軍 辻堂 演習 場 跡地 に 作ら れ た 。
場	7	ば	また 、 非 公式 協議 の 場 は もた れ て いる もの の 、 国際 リニア コライダー の 建設 が 政府 間 国際 協定 の もと に すでに 保障 決定 済み 、 と いう 状況 下 に も ない 。
場	5	ジョウ	現在 , 普天間 飛行 場 の 周辺 民家 は 大変 危険 な 状態 に あり , 現実 に 即し て 言う なら ば , 日米 合意 の 通り , 辺野古 移設 以外 に 道 は あり ませ ん 。
場	29	ジョウ	10 世紀 の 皇帝 コンスタンティノス 7 世 は 著書 『 儀式 の 書 』 で 、 サラセン 人 また は アラブ 人 が 訪れ た 際 の 競馬 場 の 装飾 に つい て 記し て おり 、 紫 の 壁掛け や 珍しい タペストリー など に 言及 し て いる 。
場	25	ば	“ 協助 ” に より 2 対 1 と いう 簡単 に は 逃げ られ ない 状況 を 作り上げ , 勧誘 員 は その 場 の ヘゲモニー を 握る こと が できる 。
場	8	ジョウ	1984 年 から は WWF に 主戦 場 を 絞り 、 ティト ・ サンタナ と インター コンチネンタル 王座 を 巡り 名 勝負 を 繰り広げる 。
場	44	ば	元々 は 、 当時 MMO RPG に 凝っ て い た GM の 菊池 たけし が 、 プレイ し て いる ゲーム に 登場 する アコライト の 少女 を 出し たい ため に 作っ た ちょい役 の キャラクター で 、 名前 も その 場 で そこ に あっ た ジュース から 付け られ た ほど 。
場	9	ば	これ は , 消費 者 が マーケティング の 場 と し て の ソーシャル メディア を 受け入れ , その 傾向 が 強まり つつ ある こと の 表れ で ある 。
場	2	ジョウ	駐車 場 は 少し 分かり にくい の で 、 店員 さん に 確認 し て み て 下さい 。
場	11	ジョウ	関門 海峡 を 眼下 に 望める 風光 明媚 な 競輪 場 と し て 知ら れ 、 シンボル マーク は かもめ が M 字 型 に 羽 を 広げ た もの 。
場	3	ジョウ	浦和 競馬 場 の 第 3 コーナー は 非常 に 危険 と の 指摘 は 以前 から なさ れ て おり 、 松井 達也 騎手 の 死亡 事故 も 第 3 コーナー で 起こっ て いる 。
場	65	ジョウ	取り調べ 段階 で は 黙秘 を 貫き “ 全て は 裁判 官 の 前 で 話す ” と し て い た 被告 は , 犯行 を 認め た もの の 教祖 へ の 逮捕 状 発布 の 経緯 に 関し “ 捜査 当局 の 不 手際 , 失態 ” と 元 同僚 ら を 非難 , 法廷 は 一時 元 警視 の 独壇 場 と なっ た 。
場	13	ジョウ	イーアス の 中 に ある 映画 館 な の で 、 駐車 場 が 広い の も Good 。
場	7	ジョウ	白馬 に 入る 入り口 の スキー 場 で も あっ て とても 奇麗 で やる こと いっぱい !
場	30	ジョウ	ちなみ に 、 大阪 市 は 現在 の 長居 公園 に 1951 年 11 月 、 大阪 競馬 場 を 利用 し て 、 市営 の 長居 オート レース 場 も 開設 し た が 、 爆音 に かかる 周辺 環境 問題 や 経営 不振 を 理由 に 、 わずか 5 ヶ月 で 廃止 し た 。
場	2	ジョウ	駐車 場 は ある もの の 立体 駐車 場 で 出入り に 時間 が かかり 、 6 号 と 14 号 の 交差 点 前 で 交通 量 が 多く かつ 駅前 直結 な ため 常 に 混雑 し て おり 、 事実 上 地元 の 人 以外 の アクセス は 辛い です 。
場	9	ジョウ	駐車 場 は ある もの の 立体 駐車 場 で 出入り に 時間 が かかり 、 6 号 と 14 号 の 交差 点 前 で 交通 量 が 多く かつ 駅前 直結 な ため 常 に 混雑 し て おり 、 事実 上 地元 の 人 以外 の アクセス は 辛い です 。
